{
  "id": "char-idle-e",
  "output": "assets-src/character/char-idle-e.png",
  "task": "RB7",
  "source": "opus",
  "derivedFrom": "char-turnaround",
  "palette": "v2",
  "density": 2,
  "cleanup": "Redrawn at 2x density (64x128 cells, feet on row 123, origin (32, 123), 115 px tall) on the approved remaster turnaround (assets-src/refs/remaster/char-turnaround@4x.png, RG1b), core palette only. The current 1x frames were nearest-upscaled as the pose and timing template and every frame was onion-skinned against them. Neutral is the anchor's side view unchanged; the breath frame lifts the collar, shoulders and sleeves 2 px (rows 31-50) while the head (rows 0-28) stays put so the talk-head overlay lines up; the blink closes the eye pixel to skin C under the lid line. Frame order matches the engine's idle cycle: neutral, breath, blink. Codex RC7 char-idle-e@2x not needed beyond confirming the pose. I2 (contrast walk): the lit-side outline of the hair, beard edge and shoes moves from wood 6 to the v2 darkest wood &, the local ramp's darkest step, on every silhouette-edge 6 pixel (talk heads follow their idle frames), so the head and feet separate from wood and plum walls: & is 0.119 OKLab from Zurich's wallpaper j (6 was 0.070) and 0.127 from London's panel wood 7 (6 was 0.060).",
  "approvedBy": "opus (RB7 build agent, delegated pick)",
  "date": "2026-09-29"
}
