{
  "id": "hall-obj-arch",
  "output": "src/assets/scenes/hall/obj-arch.png",
  "task": "RB2",
  "source": "opus",
  "derivedFrom": "hall-bg",
  "palette": "v2",
  "density": 2,
  "date": "2026-09-29",
  "cleanup": "RB2: the walk-through security arch redrawn at 2x (64x118) on B2's exact 32x59 footprint, so the posts stay in the walkbox's keyhole slits (candidate 04's arch has the same geometry but could not be separated cleanly from the gate wall behind it): an aluminium header with a lit top, screws, a dark display in a bezel and a green and a red lamp; a soffit; two posts with a lit edge and a recessed sensor strip; feet with teal contact shadows. Position (249, 70), baseline 128, unchanged."
}
