{
  "id": "char-walk-e",
  "output": "assets-src/character/char-walk-e.png",
  "task": "RB7",
  "source": "opus",
  "derivedFrom": "char-turnaround",
  "palette": "v2",
  "density": 2,
  "cleanup": "Redrawn at 2x density (64x128 cells, feet on row 123, origin (32, 123), 115 px tall) on the approved remaster turnaround (assets-src/refs/remaster/char-turnaround@4x.png, RG1b), core palette only. The current 1x frames were nearest-upscaled as the pose and timing template and every frame was onion-skinned against them. Built from the anchor's side view: its head, its torso (the arm lifted off and the back of the sweater repainted in G with a * lit strip and a hem band), its sleeve-and-hand sprite swung about the shoulder (27, 40) to each frame's 1x hand position, and its shoe. Legs are redrawn per frame from the 1x hip, knee and ankle positions (doubled), 13 to 11 px wide, in the anchor's denim ramp: F lit outline, + lit step, I base, H shade, F deep shade, 0 shadow outline, a dashed inner seam, a knee crease on bent legs and a * hem above the shoe; the far leg, far shoe and far arm one ramp step darker. Shoes are the anchor's, rotated about the heel for the heel strike, about the toe for the push-off and about the ankle for the lifted feet, then re-outlined. Frames 4-7 are frames 0-3 with the legs swapped; frame 2 now shows the planted leg nearest the viewer (the 1x frame had the same silhouette with the depth swapped). 2 px bob on the two down frames. The planted foot moves back 6, 6, 8, 6 px per frame, twice the 1x 3, 3, 4, 3, so the stride is 52 sheet px (26 logical). Codex RC6 sheets 01 and 03 (char-walk-e@2x) used only as detail reference for the knee bend and the lifted-foot angles.",
  "approvedBy": "opus (RB7 build agent, delegated pick)",
  "date": "2026-09-29"
}
