{
  "id": "char-talk-s",
  "output": "assets-src/character/char-talk-s.png",
  "task": "RB7",
  "source": "opus",
  "derivedFrom": "char-turnaround",
  "palette": "v2",
  "density": 2,
  "cleanup": "Three 32x32 mouth frames cut from the anchor's front head (head pixels only, rows 0-28, so the overlay sits cleanly on every idle frame including the breath and blink): closed (the teeth painted over in lip B), the anchor's grin, and open (a dark 1 mouth under the teeth, the lower lip dropped a row). talkHeadOffset (17, 3), measured by centring the union of the front and side head bounding boxes (x 22-42, y 9-28) in the 32x32 cell.",
  "approvedBy": "opus (RB7 build agent, delegated pick)",
  "date": "2026-09-29"
}
