{
  "id": "zurich-anim-cuckoo",
  "output": "src/assets/scenes/zurich/anim-cuckoo.png",
  "task": "B1",
  "source": "opus",
  "derivedFrom": "zurich-bg",
  "palette": "v1",
  "cleanup": "10 opaque frames of the clock's gable: the little door opens, the cuckoo pops out and calls twice (beak open), then goes back in. Frame 0 matches bg.",
  "date": "2026-09-29"
}
