{
  "id": "char-walk-s",
  "output": "assets-src/character/char-walk-s.png",
  "task": "RB7",
  "source": "opus",
  "derivedFrom": "char-turnaround",
  "palette": "v2",
  "density": 2,
  "cleanup": "Redrawn at 2x density (64x128 cells, feet on row 123, origin (32, 123), 115 px tall) on the approved remaster turnaround (assets-src/refs/remaster/char-turnaround@4x.png, RG1b), core palette only. The current 1x frames were nearest-upscaled as the pose and timing template and every frame was onion-skinned against them. The anchor's front view: 2 px bob on the two down frames, each foot lifting 2, 4, then 6 px with the shin sheared 2 px inwards on the passing frame, and the forearms swinging 2 px against the stepping leg, all doubled from the 1x frames. Codex RC6 char-walk-s@2x consulted for the lift timing only. I2 (contrast walk): the lit-side outline of the hair, beard edge and shoes moves from wood 6 to the v2 darkest wood &, the local ramp's darkest step, on every silhouette-edge 6 pixel (talk heads follow their idle frames), so the head and feet separate from wood and plum walls: & is 0.119 OKLab from Zurich's wallpaper j (6 was 0.070) and 0.127 from London's panel wood 7 (6 was 0.060).",
  "approvedBy": "opus (RB7 build agent, delegated pick)",
  "date": "2026-09-29"
}
