{
  "id": "london-obj-table",
  "output": "src/assets/scenes/london/obj-table.png",
  "task": "RB3",
  "source": "codex",
  "prompt": "assets-src/prompts/remaster/london.md",
  "candidate": "02",
  "references": [
    "assets-src/refs/remaster/london-current@4x.png",
    "assets-src/refs/remaster/style-anchor@4x.png"
  ],
  "approvedRaw": "assets-src/approved/london-bg@2x.webp",
  "palette": "v2",
  "density": 2,
  "cleanup": "RB3: the round table with two pints and its two stools, cut at 2x (logical 28, 88): the table top and glasses as solid shapes, the pedestal and base, the red seats by colour, and the stools' legs and brass foot rings by colour, so the floor and wainscot between the legs stay in bg and Daniele shows through when he walks behind them. The legs' contact shadows are kept below the baseline.",
  "approvedBy": "opus-orchestrator (delegated RB3 pick)",
  "date": "2026-09-29"
}
